{
  "$schema": "https://json-schema.org/draft-07/schema#",
  "$id": "https://tensorplate.com/schemas/v0.1/agent.json",
  "title": "TensorPlate Agent Config",
  "description": "Runtime configuration for `tensorplate-agent` (V01-E08). The agent loads this file at startup, validates it before opening the local control transport, and refuses to mutate durable state until validation succeeds.",
  "type": "object",
  "additionalProperties": false,
  "required": ["state_dir", "staging_dir"],
  "allOf": [
    {
      "$comment": "transport defaults to unix_socket, so an ABSENT transport also requires socket_path. Without the anyOf the default case slips through and a schema-valid config fails at startup.",
      "if": {
        "anyOf": [
          {"properties": {"transport": {"const": "unix_socket"}}, "required": ["transport"]},
          {"not": {"required": ["transport"]}}
        ]
      },
      "then": {
        "required": ["socket_path"],
        "properties": {"socket_path": {"pattern": "^/"}}
      }
    },
    {
      "$comment": "The loopback restriction applies to the host actually bound. Under a unix socket the value is unused and the runtime never reads it, so rejecting a leftover here would refuse a config that starts.",
      "if": {"properties": {"transport": {"const": "loopback_tcp"}}, "required": ["transport"]},
      "then": {"properties": {"tcp_bind_host": {"enum": ["127.0.0.1", "::1", "localhost"]}}}
    },
    {
      "if": {
        "properties": {"worker": {"properties": {"mode": {"const": "process"}}, "required": ["mode"]}},
        "required": ["worker"]
      },
      "then": {"not": {"required": ["supervision"]}}
    }
  ],
  "properties": {
    "schema_version": {"type": "string", "const": "0.1"},
    "transport": {
      "type": "string",
      "enum": ["unix_socket", "loopback_tcp"],
      "default": "unix_socket",
      "description": "Local control API transport. v0.1.0 default: Unix domain socket. Loopback HTTP is reserved for environments where UDS is unavailable; the agent records the decision rationale in logs at startup."
    },
    "socket_path": {
      "type": "string",
      "description": "Filesystem path for the Unix domain socket. Required when transport is `unix_socket`."
    },
    "tcp_bind_host": {
      "type": "string",
      "default": "127.0.0.1",
      "description": "Loopback literal only, enforced under `loopback_tcp` where it is actually bound. The agent refuses any other host: the control API is local-only, and binding it wider is not a configuration this release serves."
    },
    "tcp_bind_port": {"type": "integer", "minimum": 0, "maximum": 65535},
    "state_dir": {
      "type": "string",
      "pattern": "^/",
      "description": "Absolute directory where the durable state file lives. Created if missing."
    },
    "staging_dir": {
      "type": "string",
      "pattern": "^/",
      "description": "Absolute directory where deploy transactions stage verified bundles. Each deployment lives under `<staging_dir>/<deployment_id>/`."
    },
    "available_backends": {
      "type": "array",
      "minItems": 1,
      "description": "Backends the agent will accept in a bundle's `backend_hint`. The agent does not infer availability heuristically; this list is sourced from `tensorplate doctor` output in production.",
      "items": {
        "type": "string",
        "minLength": 1,
        "pattern": "\\S"
      },
      "default": ["mock"]
    },
    "backend_capabilities": {
      "type": "object",
      "description": "Capability flags published by each available backend. The agent consults this map when a bundle declares `capability_requirements`. Missing entries are treated as no-capability-published.",
      "additionalProperties": {
        "type": "object",
        "additionalProperties": false,
        "properties": {
          "async": {"type": "boolean", "default": false},
          "streaming": {"type": "boolean", "default": false},
          "generation": {"type": "boolean", "default": false},
          "kv_cache": {"type": "boolean", "default": false},
          "fixed_shape": {"type": "boolean", "default": false},
          "deterministic_latency": {"type": "boolean", "default": false},
          "control_loop_integration": {"type": "boolean", "default": false},
          "supported_precision": {
            "type": "array",
            "items": {
              "type": "string",
              "enum": ["auto", "fp32", "fp16", "bfloat16", "int8", "int4"]
            },
            "default": []
          },
          "supported_artifact_kinds": {
            "type": "array",
            "items": {
              "type": "string",
              "enum": [
                "tensorrt_engine",
                "libtorch_state",
                "python_pytorch_entry",
                "onnx",
                "vitis_xmodel",
                "weights",
                "tokenizer",
                "calibration",
                "auxiliary"
              ]
            },
            "default": []
          }
        }
      }
    },
    "memory_admission": {
      "type": "object",
      "additionalProperties": false,
      "required": [
        "row_id",
        "memory_profile_instance_id",
        "domains"
      ],
      "properties": {
        "row_id": {
          "type": "string",
          "pattern": "^[a-z0-9]+(-[a-z0-9]+)*$"
        },
        "memory_profile_instance_id": {
          "type": "string",
          "pattern": "^[a-z0-9]+(-[a-z0-9]+)*$"
        },
        "domains": {
          "type": "object",
          "additionalProperties": false,
          "required": [
            "guest_ram",
            "device_vram"
          ],
          "properties": {
            "guest_ram": {
              "type": "object",
              "additionalProperties": false,
              "required": [
                "reserve_bytes"
              ],
              "properties": {
                "cap_bytes": {
                  "type": "integer",
                  "minimum": 1,
                  "maximum": 9007199254740991,
                  "description": "Optional policy cap; omission resolves to measured capacity. A cap above the measurement is refused."
                },
                "reserve_bytes": {
                  "type": "integer",
                  "minimum": 0,
                  "maximum": 9007199254740991,
                  "description": "Explicit row reserve, with no default. Must not exceed the resolved cap."
                }
              }
            },
            "device_vram": {
              "type": "object",
              "additionalProperties": false,
              "required": [
                "reserve_bytes"
              ],
              "properties": {
                "cap_bytes": {
                  "type": "integer",
                  "minimum": 1,
                  "maximum": 9007199254740991,
                  "description": "Optional policy cap; omission resolves to measured capacity. A cap above the measurement is refused."
                },
                "reserve_bytes": {
                  "type": "integer",
                  "minimum": 0,
                  "maximum": 9007199254740991,
                  "description": "Explicit row reserve, with no default. Must not exceed the resolved cap."
                }
              }
            }
          }
        }
      },
      "description": "Optional discrete-GPU admission configuration joined to a platform row and memory-profile instance. Both domains require explicit reserves. No sampling or admission policy is enabled by this shape alone."
    },
    "device_memory_bytes": {
      "type": "integer",
      "minimum": 0,
      "description": "Total device/system memory available to the runtime. Used by the capacity_checked phase to reject bundles whose memory estimate exceeds capacity."
    },
    "device_family": {
      "type": "string",
      "enum": ["any", "jetson-orin", "jetson-thor", "kria", "x86_64"],
      "default": "any"
    },
    "admission_posture": {
      "type": "string",
      "enum": ["technical_prerequisites", "validated_row_required"],
      "description": "How strictly this machine must be judged before a deploy is admitted. Omit to let the matched platform row's own floor decide. A value here can only make admission stricter: it is resolved as the maximum of this and the row's floor, so an edge row's requirement cannot be switched off by configuration. An unrecognised value is a startup error, not a silent fallback."
    },
    "runtime_version": {
      "type": "string",
      "description": "Runtime version this config was written for. Normally absent: the agent fills it in at load with its own version, and it is recorded rather than matched."
    },
    "worker": {
      "type": "object",
      "additionalProperties": false,
      "$comment": "mode=process spawns a binary, so the path is required there and only there. The default is mock, which needs none.",
      "allOf": [
        {
          "if": {"properties": {"mode": {"const": "process"}}, "required": ["mode"]},
          "then": {
            "required": ["serving_binary_path"],
            "properties": {
              "serving_binary_path": {"pattern": "^/"},
              "serving_config_dir": {"pattern": "^/"},
              "serving_bind_host": {"enum": ["127.0.0.1", "::1", "localhost"]},
              "serving_bind_port": {"minimum": 1},
              "serving_candidate_bind_port": {"minimum": 1},
              "serving_port_range": {
                "properties": {
                  "first": {"minimum": 1}
                }
              }
            }
          }
        }
      ],
      "properties": {
        "mode": {
          "type": "string",
          "enum": ["mock", "process"],
          "default": "mock",
          "description": "`mock` uses the deterministic in-process worker for host CI. `process` spawns and supervises the V01-E07 tensorplate-serving binary."
        },
        "serving_binary_path": {
          "type": "string",
          "description": "Absolute path to tensorplate-serving. Required when worker.mode=process."
        },
        "serving_bind_host": {
          "type": "string",
          "default": "127.0.0.1",
          "description": "Loopback host used for process-backed serving workers."
        },
        "serving_bind_port": {
          "type": "integer",
          "minimum": 0,
          "maximum": 65535,
          "default": 18080,
          "description": "Primary loopback port used by the process-backed worker."
        },
        "serving_candidate_bind_port": {
          "type": "integer",
          "minimum": 0,
          "maximum": 65535,
          "default": 18081,
          "description": "Alternate loopback port used while warming a replacement candidate."
        },
        "serving_port_range": {
          "type": "object",
          "additionalProperties": false,
          "required": ["first", "last"],
          "description": "Loopback ports the process-backed workers are given, `first` to `last` inclusive. Each worker generation holds a pair from it, an HTTP port and the port after it for its stream listener, from its start until its process has been reaped; pairs are taken in order from `first`, and a port left over by an odd count is not used. When this is set, `serving_bind_port` and `serving_candidate_bind_port` are not used, though still checked. When it is absent those two ports are the pool, one worker each, and no stream port is held. Rule the agent enforces beyond this schema in process mode: the range holds at least two pairs, which a range that runs backwards does not.",
          "properties": {
            "first": {"type": "integer", "minimum": 0, "maximum": 65535},
            "last": {"type": "integer", "minimum": 0, "maximum": 65535}
          }
        },
        "serving_use_mock_session": {
          "type": "boolean",
          "default": false,
          "description": "Pass deployment.use_mock_session=true to tensorplate-serving while still exercising the process boundary."
        },
        "serving_config_dir": {
          "type": "string",
          "description": "Absolute directory where agent-rendered serving-worker configs are written. Defaults to state_dir/worker-configs."
        },
        "warm_timeout_ms": {"type": "integer", "minimum": 1, "default": 30000},
        "prepare_timeout_ms": {"type": "integer", "minimum": 1, "default": 60000},
        "status_poll_interval_ms": {"type": "integer", "minimum": 1, "default": 250}
      }
    },
    "supervision": {
      "type": "object",
      "additionalProperties": false,
      "required": ["binary_path", "working_dir", "serving_config_path", "control_port"],
      "description": "Worker supervisor config. `worker.*` controls the prepare/warm/promote IPC contract; `supervision.*` controls the supervisor's own worker process lifecycle (launch, stop, restart backoff, crash-loop policy). Not allowed beside `worker.mode: process`: each would start its own serving worker.",
      "properties": {
        "binary_path": {
          "type": "string",
          "pattern": "^/",
          "description": "Absolute path to the tensorplate-serving binary the supervisor launches. Validated before any process start."
        },
        "args": {
          "type": "array",
          "items": {"type": "string"},
          "default": []
        },
        "env_allowlist": {
          "type": "array",
          "items": {"type": "string"},
          "default": [],
          "description": "Names of environment variables forwarded from the agent's environment. Empty disables env forwarding."
        },
        "working_dir": {
          "type": "string",
          "pattern": "^/",
          "description": "Absolute working directory the launched process inherits."
        },
        "serving_config_path": {
          "type": "string",
          "pattern": "^/",
          "description": "Absolute serving config the supervisor passes via `--config`."
        },
        "control_host": {
          "type": "string",
          "enum": ["127.0.0.1", "::1", "localhost"],
          "default": "127.0.0.1",
          "description": "Loopback host the worker binds its data plane to."
        },
        "control_port": {
          "type": "integer",
          "minimum": 1,
          "maximum": 65535,
          "default": 18080
        },
        "stdio_mode": {
          "type": "string",
          "enum": ["inherit", "discard", "capture_to_file"],
          "default": "inherit"
        },
        "startup_timeout_ms": {
          "type": "integer",
          "minimum": 1,
          "default": 30000
        },
        "graceful_stop_timeout_ms": {
          "type": "integer",
          "minimum": 1,
          "default": 5000
        },
        "kill_timeout_ms": {
          "type": "integer",
          "minimum": 1,
          "default": 2000
        },
        "status_poll_interval_ms": {
          "type": "integer",
          "minimum": 1,
          "default": 1000
        },
        "restart_policy": {
          "type": "object",
          "additionalProperties": false,
          "$comment": "kind defaults to bounded_backoff, so an ABSENT kind takes the bounds too. Disabled skips the block in the runtime, and constraining it here would reject a config that starts.",
          "allOf": [
            {
              "if": {"anyOf": [
                {"properties": {"kind": {"const": "bounded_backoff"}}, "required": ["kind"]},
                {"not": {"required": ["kind"]}}
              ]},
              "then": {"properties": {"backoff": {"properties": {
                "initial_delay_ms": {"minimum": 1},
                "multiplier_hundredths": {"minimum": 100},
                "max_delay_ms": {"minimum": 1},
                "window_ms": {"minimum": 1},
                "threshold": {"minimum": 1},
                "stable_reset_ms": {"minimum": 1}
              }}}}
            }
          ],
          "properties": {
            "kind": {
              "type": "string",
              "enum": ["disabled", "bounded_backoff"],
              "default": "bounded_backoff"
            },
            "backoff": {
              "type": "object",
              "additionalProperties": false,
              "description": "Bounded exponential-backoff parameters with a rolling-window crash-loop detector. All timing uses monotonic time. Bounds are enforced only where the policy uses them: `RestartPolicyKind::Disabled` skips this block entirely, so a leftover value there must not fail validation.",
              "properties": {
                "initial_delay_ms": {"type": "integer", "minimum": 0, "default": 500},
                "multiplier_hundredths": {"type": "integer", "minimum": 0, "default": 200, "description": "Geometric multiplier x100. 200 means 2.0x."},
                "max_delay_ms": {"type": "integer", "minimum": 0, "default": 30000},
                "window_ms": {"type": "integer", "minimum": 0, "default": 300000},
                "threshold": {"type": "integer", "minimum": 0, "default": 5},
                "stable_reset_ms": {"type": "integer", "minimum": 0, "default": 120000}
              }
            }
          }
        },
        "event_sink": {
          "type": "object",
          "additionalProperties": false,
          "description": "Bounded supervision-event sink config (V01-E09-F05). The sink never blocks the supervisor; events drop oldest-first when the queue is full.",
          "properties": {
            "queue_capacity": {"type": "integer", "minimum": 1, "default": 256},
            "uds_path": {
              "type": "string",
              "pattern": "^/",
              "description": "Optional Unix domain socket the observability service listens on. v0.1.0 default is in-process only; V01-E10 lights up the UDS path."
            }
          }
        }
      }
    }
  }
}
